{
  "identity": {
    "artifact_id": "NB.UMG.COMPILER_EXECUTION.v1",
    "artifact_type": "neoblock",
    "human_library_code": null,
    "content_hash": null,
    "package_hash": null,
    "version": "1.0.0"
  },
  "provenance": {
    "created": "2026-04-27",
    "created_by": "OpenClaw",
    "supervised_by": null,
    "source_library": "UMG-Block-Library",
    "source_library_version": "1.0.0",
    "reference": "AI/DOCTRINE/UMG_COMPILER_LAW.v0.3.md",
    "origin": "pure_umg_core_reference_stage_4c",
    "parent_artifact_ids": [],
    "review_state": "draft"
  },
  "neoblock": {
    "name": "UMG Compiler Execution",
    "description": "Resolve canonical IR through deterministic compiler execution into runtime outputs.",
    "status": "active",
    "version": "1.0.0",
    "category": "framework_specific",
    "tags": ["umg", "core", "compiler_execution"],
    "composition": {
      "molt_block_ids": [
        "BLK.INSTRUCTION.UMG.RUN_COMPILER.v1"
      ],
      "ordered_steps": [
        {
          "id": "step.compiler.execute",
          "uses": ["BLK.INSTRUCTION.UMG.RUN_COMPILER.v1"],
          "mode": "serial",
          "condition": null,
          "notes": "Compile canonical IR into deterministic runtime outputs."
        }
      ],
      "merge_rules": []
    },
    "molt_roles": {
      "compiler_instruction": ["BLK.INSTRUCTION.UMG.RUN_COMPILER.v1"]
    },
    "geometry": null,
    "capabilities": ["CAP.COMPILER.COMPILE"],
    "governance": {
      "directive_ids": [],
      "policy_links": [],
      "route_constraints": []
    },
    "examples": [],
    "notes": "Pure UMG foundation object. Declarative compile step only; no direct tool execution."
  },
  "metadata": {
    "stage": "Stage 4C",
    "batch": "remaining_core_reference_neoblocks"
  }
}
